{
  "command_or_procedure": "pytest tests/real_system/real_system_e2e.py --real-system-e2e --adc-evidence -s",
  "completed_at": "2026-09-18T19:09:32.979211+00:00",
  "environment": {
    "os": "Linux",
    "platform": "Linux-7.0.0-31-generic-x86_64-with-glibc2.39",
    "profile": null,
    "testbed": "pytest"
  },
  "event_count": 1,
  "event_ids": [
    "EVT-0001"
  ],
  "producer": "ADC",
  "repository_identity": {
    "commit": "e869f9a08db4bb66daa0df4199f8c2df4109545a",
    "dirty": false,
    "worktree": "/home/udo/AI-Dev-Center"
  },
  "run_id": "ADC-RUN-20260918T190326Z-5ae51307",
  "run_status": "completed",
  "schema_version": "1.0",
  "started_at": "2026-09-18T19:03:26.512085+00:00",
  "tool_versions": {
    "pytest": "9.1.1",
    "python": "3.12.3"
  }
}
