{
  "command_or_procedure": "pytest -q --adc-evidence tests/test_common_request.py::test_common_request_preserves_adapter_neutral_user_intent tests/test_common_request.py::test_common_requests_do_not_share_project_info_defaults tests/test_requirement_lineage.py::TestRequirementLineageThroughS23 tests/test_diagnostic_evidence.py tests/test_central_diagnostic_trace.py::test_secret_redaction_and_detail_allowlist_protect_persisted_jsonl tests/test_central_diagnostic_trace.py::test_trace_content_cannot_approve_or_release_publish_gate",
  "completed_at": "2026-09-18T15:25:13.528797+00:00",
  "environment": {
    "os": "Linux",
    "platform": "Linux-7.0.0-31-generic-x86_64-with-glibc2.39",
    "profile": null,
    "testbed": "pytest"
  },
  "event_count": 27,
  "event_ids": [
    "EVT-0001",
    "EVT-0002",
    "EVT-0003",
    "EVT-0004",
    "EVT-0005",
    "EVT-0006",
    "EVT-0007",
    "EVT-0008",
    "EVT-0009",
    "EVT-0010",
    "EVT-0011",
    "EVT-0012",
    "EVT-0013",
    "EVT-0014",
    "EVT-0015",
    "EVT-0016",
    "EVT-0017",
    "EVT-0018",
    "EVT-0019",
    "EVT-0020",
    "EVT-0021",
    "EVT-0022",
    "EVT-0023",
    "EVT-0024",
    "EVT-0025",
    "EVT-0026",
    "EVT-0027"
  ],
  "producer": "ADC",
  "repository_identity": {
    "commit": "072aab394d2ee987f29c2b5c6c3b2936eea59ae5",
    "dirty": true,
    "worktree": "/home/udo/AI-Dev-Center"
  },
  "run_id": "ADC-RUN-20260918T152513Z-a5e0638b",
  "run_status": "completed",
  "schema_version": "1.0",
  "started_at": "2026-09-18T15:25:13.442023+00:00",
  "tool_versions": {
    "pytest": "9.1.1",
    "python": "3.12.3"
  }
}
